{
  "$schema": "https://json-schema.org/draft/2020-12/schema",
  "schema_version": 1,
  "artifact_role": "GENERATED_SOURCE_MATRIX",
  "source_contract": "integrations/n8n/data-tables.json@schema_version=4",
  "source_snapshot": {
    "finance_commit": "a77ac7e0e4cf07d8f9d54a356b12ee48a4268a24",
    "data_tables_sha256": "66047a23525aa49db9b34016278e1797c52c5bbd77c2409f4de7c6cad0255d02",
    "node_scan_corpus_sha256": "6935e4bb48cfe6d80052a47a0289daff01b1f3453a83a31e4bbe167225d295c8",
    "source_ref_selection": "Content-derived Git-compatible identity over normalized data-tables.json and the scan-root directories; commit topology and generated outputs are excluded to keep provenance stable across source commits.",
    "node_scan_digest_method": "Normalize CRLF to LF, hash each JSON file under scan_roots, sort the complete hash-and-relative-path lines bytewise, then hash that stream."
  },
  "scan_roots": [
    "integrations/n8n/workflows/*.json",
    "integrations/n8n/disposable/generated/*.json",
    "integrations/n8n/setup-workflows/*.json"
  ],
  "targets": [
    "finance_ingestion_state",
    "finance_documents",
    "finance_actual_batches",
    "finance_ai_reviews"
  ],
  "target_schemas": {
    "finance_ingestion_state": {
      "logical_key": [
        "record_type",
        "record_key"
      ],
      "identity_derivations": [
        {
          "source_table": "finance_source_cursors",
          "strategy": "typed_record",
          "target_key": [
            "record_type",
            "record_key"
          ],
          "source_fields": [
            "source_code"
          ],
          "record_type": "SOURCE_CURSOR"
        },
        {
          "source_table": "finance_acquisition_receipts",
          "strategy": "typed_record",
          "target_key": [
            "record_type",
            "record_key"
          ],
          "source_fields": [
            "run_id",
            "source_code"
          ],
          "record_type": "ACQUISITION_RECEIPT"
        },
        {
          "source_table": "finance_pipeline_runs",
          "strategy": "typed_record",
          "target_key": [
            "record_type",
            "record_key"
          ],
          "source_fields": [
            "run_id",
            "workflow_code"
          ],
          "record_type": "PIPELINE_RUN"
        },
        {
          "source_table": "finance_provider_circuits",
          "strategy": "typed_record",
          "target_key": [
            "record_type",
            "record_key"
          ],
          "source_fields": [
            "provider_code"
          ],
          "record_type": "PROVIDER_CIRCUIT"
        },
        {
          "source_table": "finance_execution_failures",
          "strategy": "typed_record",
          "target_key": [
            "record_type",
            "record_key"
          ],
          "source_fields": [
            "execution_id"
          ],
          "record_type": "EXECUTION_FAILURE"
        },
        {
          "source_table": "finance_mcp_requests",
          "strategy": "typed_record",
          "target_key": [
            "record_type",
            "record_key"
          ],
          "source_fields": [
            "request_id"
          ],
          "record_type": "MCP_REQUEST"
        }
      ],
      "columns": {
        "record_type": {
          "type": "string",
          "source_bindings": [
            "typed-operational-state.record_type"
          ]
        },
        "record_key": {
          "type": "string",
          "source_bindings": [
            "typed-operational-state.record_key"
          ]
        },
        "record_payload_json": {
          "type": "string",
          "source_bindings": [
            "typed-operational-state.record_payload_json"
          ]
        },
        "source_code": {
          "type": "string",
          "source_bindings": [
            "finance_source_cursors.source_code",
            "finance_acquisition_receipts.source_code"
          ]
        },
        "receipt_run_id": {
          "type": "string",
          "source_bindings": [
            "finance_acquisition_receipts.run_id"
          ]
        },
        "receipt_run_upper_bound": {
          "type": "date",
          "source_bindings": [
            "finance_acquisition_receipts.run_upper_bound"
          ]
        },
        "cursor_value": {
          "type": "date",
          "source_bindings": [
            "finance_source_cursors.cursor_value"
          ]
        },
        "committed_run_id": {
          "type": "string",
          "source_bindings": [
            "finance_source_cursors.committed_run_id"
          ]
        },
        "run_upper_bound": {
          "type": "date",
          "source_bindings": [
            "finance_source_cursors.run_upper_bound"
          ]
        },
        "overlap_seconds": {
          "type": "number",
          "source_bindings": [
            "finance_source_cursors.overlap_seconds"
          ]
        },
        "scanned_count": {
          "type": "number",
          "source_bindings": [
            "finance_source_cursors.scanned_count",
            "finance_acquisition_receipts.scanned_count"
          ]
        },
        "matched_count": {
          "type": "number",
          "source_bindings": [
            "finance_source_cursors.matched_count",
            "finance_acquisition_receipts.matched_count"
          ]
        },
        "cursor_version": {
          "type": "number",
          "source_bindings": [
            "finance_source_cursors.cursor_version"
          ]
        },
        "readback_verified": {
          "type": "boolean",
          "source_bindings": [
            "finance_source_cursors.readback_verified",
            "finance_acquisition_receipts.readback_verified"
          ]
        },
        "updated_at": {
          "type": "date",
          "source_bindings": [
            "finance_source_cursors.updated_at",
            "finance_acquisition_receipts.updated_at"
          ]
        },
        "last_window_start": {
          "type": "date",
          "source_bindings": [
            "finance_acquisition_receipts.window_start"
          ]
        },
        "last_pages_fetched": {
          "type": "number",
          "source_bindings": [
            "finance_acquisition_receipts.pages_fetched"
          ]
        },
        "last_pagination_exhausted": {
          "type": "boolean",
          "source_bindings": [
            "finance_acquisition_receipts.pagination_exhausted"
          ]
        },
        "last_heartbeat": {
          "type": "boolean",
          "source_bindings": [
            "finance_acquisition_receipts.heartbeat"
          ]
        },
        "last_terminal_state": {
          "type": "string",
          "source_bindings": [
            "finance_acquisition_receipts.terminal_state"
          ]
        },
        "last_receipt_created_at": {
          "type": "date",
          "source_bindings": [
            "finance_acquisition_receipts.created_at"
          ]
        },
        "archive_receipt_sha256": {
          "type": "string",
          "source_bindings": [
            "acquisition-archive-proof-v1.archive_receipt_sha256"
          ]
        },
        "archive_readback_verified": {
          "type": "boolean",
          "source_bindings": [
            "acquisition-archive-proof-v1.archive_readback_verified"
          ]
        },
        "downstream_receipt_sha256": {
          "type": "string",
          "source_bindings": [
            "finance_acquisition_receipts.downstream_receipt_sha256"
          ]
        },
        "attachment_verification_barrier": {
          "type": "string",
          "source_bindings": [
            "finance_acquisition_receipts.attachment_verification_barrier"
          ]
        },
        "attachment_ids_verified": {
          "type": "boolean",
          "source_bindings": [
            "finance_acquisition_receipts.attachment_ids_verified"
          ]
        },
        "attachment_identity_keys_json": {
          "type": "string",
          "source_bindings": [
            "finance_acquisition_receipts.attachment_identity_keys_json"
          ]
        },
        "attachments_verified": {
          "type": "number",
          "source_bindings": [
            "finance_acquisition_receipts.attachments_verified"
          ]
        },
        "email_evidence_receipt_barrier": {
          "type": "string",
          "source_bindings": [
            "finance_acquisition_receipts.email_evidence_receipt_barrier"
          ]
        },
        "email_evidence_receipts_verified": {
          "type": "number",
          "source_bindings": [
            "finance_acquisition_receipts.email_evidence_receipts_verified"
          ]
        },
        "email_evidence_identity_keys_json": {
          "type": "string",
          "source_bindings": [
            "finance_acquisition_receipts.email_evidence_identity_keys_json"
          ]
        },
        "archive_ready": {
          "type": "boolean",
          "source_bindings": [
            "finance_acquisition_receipts.archive_ready"
          ]
        },
        "inventory_run_id": {
          "type": "string",
          "source_bindings": [
            "inventory-v1.inventory_run_id"
          ]
        },
        "inventory_fence": {
          "type": "number",
          "source_bindings": [
            "inventory-v1.inventory_fence"
          ]
        },
        "inventory_sha256": {
          "type": "string",
          "source_bindings": [
            "inventory-v1.inventory_sha256"
          ]
        },
        "inventory_item_id": {
          "type": "string",
          "source_bindings": [
            "inventory-v1.inventory_item_id"
          ]
        },
        "inventory_path": {
          "type": "string",
          "source_bindings": [
            "inventory-v1.inventory_path"
          ]
        },
        "inventory_etag": {